sentence_id,sentence,sentiment_label
227,It will guarantee to have you leaving the theater with a smile on your face.,2
228,"The misery of these people becomes just another voyeuristic spectacle, to be consumed and forgotten.",0
229,"A thoroughly awful movie -- dumb, narratively chaotic, visually sloppy... a weird amalgam of `The Thing' and a geriatric `Scream.'",0
230,"One of those staggeringly well-produced, joylessly extravagant pictures that keep whooshing you from one visual marvel to the next, hastily, emptily.",1
231,"Measured against practically any like-themed film other than its Oscar-sweeping franchise predecessor The Silence of the Lambs, Red Dragon rates as an exceptional thriller.",2
232,"The movie has no respect for laws, political correctness or common decency, but it displays something more important: respect for its flawed, crazy people.",1
233,"In a strange way, Egoyan has done too much.",1
234,"After seeing the film, I can tell you that there's no other reason why anyone should bother remembering it.",0
235,The film is darkly funny in its observation of just how much more grueling and time-consuming the illusion of work is than actual work.,2
236,"In some ways, Lagaan is quintessential Bollywood.",1
237,"Pacino and Williams seem to keep upping the ante on each other, just as their characters do in the film.",2
238,"It would be disingenuous to call Reno a great film, but you can say that about most of the flicks moving in and out of the multiplex.",1
239,"Some movies can get by without being funny simply by structuring the scenes as if they were jokes: a setup, delivery and payoff.",1
240,Narc can only remind us of brilliant crime dramas without becoming one itself.,1
241,Narc is a no-bull throwback to 1970s action films.,2
242,Intriguing and downright intoxicating.,2
243,"The wonderful combination of the sweetness and the extraordinary technical accomplishments of the first film are maintained, but its overall impact falls a little flat with a storyline that never quite delivers the original magic.",1
244,Perhaps the most annoying thing about Who Is Cletis Tout? is that it's a crime movie made by someone who obviously knows nothing about crime.,0
245,"In addition to scoring high for originality of plot -- putting together familiar themes of family, forgiveness and love in a new way -- Lilo & Stitch has a number of other assets to commend it to movie audiences both innocent and jaded.",2
246,The quirky drama touches the heart and the funnybone thanks to the energetic and always surprising performance by Rachel Griffiths.,2
247,"At its worst, it implodes in a series of very bad special effects.",0
248,Bad and baffling from the get-go.,0
249,"The movie is a blast of educational energy, as bouncy animation and catchy songs escort you through the entire 85 minutes.",2
250,The original wasn't a good movie but this remake makes it look like a masterpiece!,0
251,"To my taste, the film's comic characters come perilously close to being Amoses and Andys for a new generation.",1
252,"Although the sequel has all the outward elements of the original, the first film's lovely flakiness is gone, replaced by the forced funniness found in the dullest kiddie flicks.",0
253,"The real charm of this trifle is the deadpan comic face of its star, Jean Reno, who resembles Sly Stallone in a hot sake half-sleep.",1
254,"... a cute and sometimes side-splittingly funny blend of Legally Blonde and Drop Dead Gorgeous, starring Piper Perabo in what could be her breakthrough role.",2
255,"This method almost never fails him, and it works superbly here.",2
256,Few films capture so perfectly the hopes and dreams of little boys on baseball fields as well as the grown men who sit in the stands.,2
257,Steers has an unexpectedly adamant streak of warm-blooded empathy for all his disparate Manhattan denizens -- especially the a**holes.,1
258,"The Emperor's Club is one of those films that possesses all the good intentions in the world, but...",1
259,The most compelling performance of the year adds substantial depth to this shocking testament to anti-Semitism and neo-fascism.,2
260,"LaBute can't avoid a fatal mistake in the modern era: He's changed the male academic from a lower-class Brit to an American, a choice that upsets the novel's exquisite balance and shreds the fabric of the film.",1
261,A biopic about Crane's life in the classic tradition but evolves into what has become of us all in the era of video.,1
262,"A work of extraordinary journalism, but it is also a work of deft and subtle poetry.",2
263,... think of it as American Pie On Valium.,1
264,Gere gives a good performance in a film that doesn't merit it.,1
265,"""The movie is as far as you can get from racy, to the point where it almost stops the blood flow to your brain it has a dull, costumey feel.""",0
266,The Pianist is Polanski's best film.,2
267,Maybe Thomas Wolfe was right: You can't go home again.,1
268,"The director, with his fake backdrops and stately pacing, never settles on a consistent tone.",0
269,"Why he was given free reign over this project -- he wrote, directed, starred and produced -- is beyond me.",0
270,"If you enjoy being rewarded by a script that assumes you aren't very bright, then Blood Work is for you.",0
271,"Like Rudy Yellow Lodge, Eyre needs to take a good sweat to clarify his cinematic vision before his next creation and remember the lessons of the trickster spider.",0
272,But his showboating wise-cracker stock persona sure is getting old.,1
273,"Circuit queens won't learn a thing, they'll be too busy cursing the film's strategically placed white sheets.",1
274,"A lot of talent is wasted in this crass, low-wattage endeavor.",0
275,"Alain Choquart's camera barely stops moving, portraying both the turmoil of the time and giving Conduct a perpetual sense of urgency, which, for a film that takes nearly three hours to unspool, is both funny and irritating.",1
276,The second coming of Harry Potter is a film far superior to its predecessor.,2
277,This stuck pig of a movie flails limply between bizarre comedy and pallid horror.,0
278,"The film just might turn on many people to opera, in general, an art form at once visceral and spiritual, wonderfully vulgar and sublimely lofty -- and as emotionally grand as life.",2
279,"The delicious trimmings... arrive early and stay late, filling nearly every minute... with a lighthearted glow, some impudent snickers, and a glorious dose of humankind's liberating ability to triumph over a Scrooge or two.",2
280,"The inhospitability of the land emphasizes the spare precision of the narratives and helps to give them an atavistic power, as if they were tales that had been handed down since the beginning of time.",1
281,Even more baffling is that it's funny.,1
282,"Parker should be commended for taking a fresh approach to familiar material, but his determination to remain true to the original text leads him to adopt a somewhat mannered tone... that ultimately dulls the human tragedy at the story's core.",1
283,"Hard, endearing, caring, warm.",2
284,"I have no problem with ``difficult'' movies, or movies that ask the audience to meet them halfway and connect the dots instead of having things all spelled out.",1
285,The way Coppola professes his love for movies -- both colorful pop junk and the classics that unequivocally qualify as art -- is giddily entertaining.,2
286,Both the crime story and the love story are unusual.,1
287,It's never a good sign when a film's star spends the entirety of the film in a coma.,0
288,A creaky staircase gothic.,1
289,"If there's a way to effectively teach kids about the dangers of drugs, I think it's in projects like the (unfortunately R-rated) Paid.",1
290,"If you're a WWF fan, or you related to the people who watched the robots getting butchered in A.I., you'll probably like Rollerball.",1
291,Norton holds the film together.,1
292,"A breathtaking adventure for all ages, Spirit tells its poignant and uplifting story in a stunning fusion of music and images.",2
293,It won't bust your gut -- and it's not intended to -- it's merely a blandly cinematic surgical examination of what makes a joke a joke.,1
294,Largely a for-fans artifact.,1
295,A movie so bad that it quickly enters the pantheon of wreckage that includes Battlefield Earth and Showgirls.,0
296,"If you're over 25, have an IQ over 90, and have a driver's license, you should be able to find better entertainment.",0
297,A solid piece of journalistic work that draws a picture of a man for whom political expedience became a deadly foreign policy.,1
298,"The doofus-on-the-loose banter of Welcome to Collinwood has a cocky, after-hours loopiness to it.",1
299,It's the funniest American comedy since Graffiti Bridge.,2
300,Samuel Beckett applied to the Iranian voting process.,1
301,A strangely compelling and brilliantly acted psychological drama.,2
302,"Often gruelling and heartbreaking to witness, but Seldahl and Wollter's sterling performances raise this far above the level of the usual maudlin disease movie.",2
303,"This enthralling documentary... is at once playful and haunting, an in-depth portrait of an iconoclastic artist who was fundamentally unknowable even to his closest friends.",2
304,"I didn't laugh at the ongoing efforts of Cube, and his skinny buddy Mike Epps, to make like Laurel and Hardy'n the hood.",0
305,"At its best when the guarded, resentful Betty and the manipulative yet needy Margot are front and center.",1
306,Ford deserves to be remembered at Oscar time for crafting this wonderful portrait of a conflicted soldier.,2
307,"That is essentially what's missing from Blackboards -- the sense of something bigger, some ultimate point.",1
308,"It's a bizarre curiosity memorable mainly for the way it fritters away its potentially interesting subject matter via a banal script, unimpressive acting and indifferent direction.",1
309,"While obviously an extremely personal work, it remains inextricably stuck in an emotionally unavailable rut.",1
310,"A dim-witted and lazy spin-off of the Animal Planet documentary series, Crocodile Hunter is entertainment opportunism at its most glaring.",0
311,"The good is very, very good... The rest runs from mildly unimpressive to despairingly awful.",1
312,"Methodical, measured, and gently tedious in its comedy, Secret Ballot is a purposefully reductive movie -- which may be why it's so successful at lodging itself in the brain.",2
313,One of the most exciting action films to come out of China in recent years.,2
314,Adam Sandler's Eight Crazy Nights grows on you -- like a rash.,0
315,"The film feels formulaic, its plot and pacing typical Hollywood war-movie stuff, while the performances elicit more of a sense of deja vu than awe.",0
316,"... pitiful, slapdash disaster.",0
317,"As it stands, there's some fine sex onscreen, and some tense arguing, but not a whole lot more.",1
318,It's neither as romantic nor as thrilling as it should be.,0
319,Returning director Rob Minkoff... and screenwriter Bruce Joel Rubin... have done a fine job of updating White's dry wit to a new age.,2
320,"The Venezuelans say things like ``si, pretty much'' and ``por favor, go home'' when talking to Americans.",1
321,"If you already like this sort of thing, this is that sort of thing all over again.",1
322,An awful movie that will only satisfy the most emotionally malleable of filmgoers.,0
323,"This is an extraordinary film, not least because it is Japanese and yet feels universal.",2
324,"Aptly named, this shimmering, beautifully costumed and filmed production doesn't work for me.",1
325,"If Borstal Boy isn't especially realistic, it is an engaging nostalgia piece.",1
326,Griffiths proves she's that rare luminary who continually raises the standard of her profession.,2
327,"The asylum material is gripping, as are the scenes of Jia with his family.",2
328,"... by the time it's done with us, Mira Nair's new movie has its audience giddy with the delight of discovery, of having been immersed in a foreign culture only to find that human nature is pretty much the same all over.",2
329,... about as exciting to watch as two last-place basketball teams playing one another on the final day of the season.,0
330,Girls gone wild and gone civil again,1
331,To say Analyze That is De Niro's best film since Meet the Parents sums up the sad state of his recent career.,1
332,"Like being trapped inside a huge video game, where exciting, inane images keep popping past your head and the same illogical things keep happening over and over again.",1
333,`Enigma' is the kind of engaging historical drama that Hollywood appears to have given up on in favor of sentimental war movies in the vein of `We Were Soldiers.',1
334,The Rock has a great presence but one battle after another is not the same as one battle followed by killer CGI effects.,1
335,Visually sumptuous but intellectually stultifying.,1
336,"So young, so smart, such talent, such a wise ***.",2
337,"The problem is that for the most part, the film is deadly dull.",0
338,A thinly veiled look at different aspects of Chinese life clashing with each other.,1
339,An exhilarating experience.,2
340,Its vision of that awkward age when sex threatens to overwhelm everything else is acute enough to make everyone who has been there squirm with recognition.,1
341,Remarkably accessible and affecting.,2
342,"The climactic events are so well realized that you may forget all about the original conflict, just like the movie does.",1
343,Distinctly sub-par... more likely to drown a viewer in boredom than to send any shivers down his spine.,0
344,Godard's ode to tackling life's wonderment is a rambling and incoherent manifesto about the vagueness of topical excess... In Praise of Love remains a ponderous and pretentious endeavor that's unfocused and tediously exasperating.,0
345,"""Shamelessly resorting to pee-related sight gags that might even cause Tom Green a grimace still, Myer's energy and the silliness of it all eventually prevail.""",1
346,"We never truly come to care about the main characters and whether or not they'll wind up together, and Michele's spiritual quest is neither amusing nor dramatic enough to sustain interest.",0
347,"Most haunting about ``Fence'' is its conclusion, when we hear the ultimate fate of these girls and realize, much to our dismay, that this really did happen.",2
348,"Bogdanovich taps deep into the Hearst mystique, entertainingly reenacting a historic scandal.",2
349,"Peralta's mythmaking could have used some informed, adult hindsight.",1
350,"``My god, I'm behaving like an idiot!''",1
351,"Devos and Cassel have tremendous chemistry -- their sexual and romantic tension, while never really vocalized, is palpable.",2
352,"As a girl-meets-girl romantic comedy, Kissing Jessica Steinis quirky, charming and often hilarious.",2
353,Gollum's `performance' is incredible!,2
354,"... a haunting vision, with images that seem more like disturbing hallucinations.",0
355,"As a remake, it's a pale imitation.",0
356,Adults will certainly want to spend their time in the theater thinking up grocery lists and ways to tell their kids how not to act like Pinocchio.,1
357,"Not as distinctive or even as humorous as its needs to be to stand out, but it has clearly been made with affection and care.",1
358,A generic family comedy unlikely to be appreciated by anyone outside the under-10 set.,0
359,"An amalgam of The Fugitive, Blade Runner, and Total Recall, only without much energy or tension.",1
360,"Everything its title implies, a standard-issue crime drama spat out from the Tinseltown assembly line.",1
361,"This odd, poetic road movie, spiked by jolts of pop music, pretty much takes place in Morton's ever-watchful gaze -- and it's a tribute to the actress, and to her inventive director, that the journey is such a mesmerizing one.",2
362,"Co-writer/director Jonathan Parker's attempts to fashion a Brazil-like, hyper-real satire fall dreadfully short.",0
363,"An amateurish, quasi-improvised acting exercise shot on ugly digital video.",0
364,"``The Kid Stays in the Picture'' is a great story, terrifically told by the man who wrote it but this Cliff Notes edition is a cheat.",1
365,"A gratingly unfunny groaner littered with zero-dimensional, unlikable characters and hackneyed, threadbare comic setups.",0
366,"While this gentle and affecting melodrama will have luvvies in raptures, it's far too slight and introspective to appeal to anything wider than a niche audience.",1
367,Griffin & Co. manage to be spectacularly outrageous.,2
368,"A profoundly stupid affair, populating its hackneyed and meanspirited storyline with cardboard characters and performers who value cash above credibility.",0
369,"Warm Water Under a Red Bridge is a quirky and poignant Japanese film that explores the fascinating connections between women, water, nature, and sexuality.",2
370,It isn't that Stealing Harvard is a horrible movie -- if only it were that grand a failure!,0
371,It just doesn't have much else... especially in a moral sense.,1
372,Those unfamiliar with Mormon traditions may find The Singles Ward occasionally bewildering.,1
373,"Viewed as a comedy, a romance, a fairy tale, or a drama, there's nothing remotely triumphant about this motion picture.",1
374,"But the talented cast alone will keep you watching, as will the fight scenes.",2
375,It's solid and affecting and exactly as thought-provoking as it should be.,2
376,"Thanks largely to Williams, all the interesting developments are processed in 60 minutes -- the rest is just an overexposed waste of film.",0
377,"Cantet perfectly captures the hotel lobbies, two-lane highways, and roadside cafes that permeate Vincent's days",2
378,"An important movie, a reminder of the power of film to move us and to make us examine our values.",2
379,"Too much of this well-acted but dangerously slow thriller feels like a preamble to a bigger, more complicated story, one that never materializes.",0
380,A richly imagined and admirably mature work from a gifted director who definitely has something on his mind.,2
381,"The art direction is often exquisite, and the anthropomorphic animal characters are beautifully realized through clever makeup design, leaving one to hope that the eventual DVD release will offer subtitles and the original Italian-language soundtrack.",2
382,"... Jones, despite a definitely distinctive screen presence, just isn't able to muster for a movie that, its title notwithstanding, should have been a lot nastier if it wanted to fully capitalize on its lead's specific gifts.",1
383,But what's nice is that there's a casual intelligence that permeates the script.,2
384,Wedding feels a bit anachronistic.,0
385,"An action/thriller of the finest kind, evoking memories of Day of the Jackal, The French Connection, and Heat.",2
386,"This picture is murder by numbers, and as easy to be bored by as your ABC's, despite a few whopping shootouts.",0
387,"Every individual will see the movie through the prism of his or her own beliefs and prejudices, but the one thing most will take away is the sense that peace is possible.",2
388,"Feels slight, as if it were an extended short, albeit one made by the smartest kids in class.",1
389,The picture doesn't know it's a comedy.,1
390,A classy item by a legend who may have nothing left to prove but still has the chops and drive to show how its done.,2
391,"Starts out mediocre, spirals downward, and thuds to the bottom of the pool with an utterly incompetent conclusion.",0
392,The sort of movie that gives tastelessness a bad rap.,0
393,Its engaging simplicity is driven by appealing leads.,2
394,"Fans of the TV series will be disappointed, and everyone else will be slightly bored.",1
395,"It's a head-turner -- thoughtfully written, beautifully read and, finally, deeply humanizing.",2
396,"""Bray is completely at sea with nothing but a Savage Garden music video on his resume, he has no clue about making a movie.""",0
397,"It's not a particularly good film, but neither is it a monsterous one.",1
398,Men in Black II achieves ultimate insignificance -- it's the sci-fi comedy spectacle as Whiffle-Ball epic.,0
399,Martyr gets royally screwed and comes back for more.,1
